Forum_ID,Judul,Deskripsi,Tag
1,How to start learning machine learning effectively?,"I am new to machine learning and want to know the best way to learn effectively. Any recommendations for resources or strategies?","machine learning, beginner, learning resources, strategies"
2,Which algorithms are essential for machine learning beginners?,"For someone starting in machine learning, which algorithms should they focus on mastering first?","machine learning, algorithms, beginners, AI models"
3,How does deep learning differ from traditional machine learning?,"Deep learning is often discussed in AI. What makes it different from traditional machine learning approaches?","machine learning, deep learning, AI, neural networks"
4,What are the applications of reinforcement learning in real-world scenarios?,"Reinforcement learning has so many applications. Can someone share real-world scenarios where it is successfully used?","machine learning, reinforcement learning, applications, examples"
5,How to optimize a machine learning model for better accuracy?,"I am trying to improve my model's performance. How can I optimize it for better accuracy?","machine learning, optimization, accuracy, performance"
6,What are the best datasets for machine learning beginners?,"As a beginner, I am looking for datasets to practice on. What are some good options?","machine learning, datasets, beginner, practice"
7,What are the ethical concerns in machine learning?,"I am curious about the ethical challenges and how to address them in machine learning.","machine learning, ethics, challenges, responsible AI"
8,What is the role of feature scaling in machine learning?,"I often see feature scaling mentioned in tutorials. Can someone explain why it is important?","machine learning, feature scaling, preprocessing, importance"
9,How to choose the right evaluation metric for a machine learning model?,"There are so many metrics to choose from. How do I decide which one fits my model's goals?","machine learning, evaluation metrics, accuracy, precision"
10,What is the difference between batch and online learning?,"I am confused about batch learning versus online learning. Can someone clarify the differences and use cases?","machine learning, batch learning, online learning, use cases"
26,What are the best practices for mobile app design?,"Designing mobile apps can be tricky. I am looking for tips or guidelines to create a user-friendly and visually appealing app.","mobile development, app design, user experience, UI/UX"
27,What are the benefits of cross-platform mobile development?,"Cross-platform development seems popular. Can someone explain its advantages and whether it is better than native development?","mobile development, cross-platform, native apps, development"
28,What are the challenges in developing a native mobile app?,"Native mobile apps are known for high performance. What are the common challenges developers face when creating such apps?","mobile development, native apps, challenges, coding"
29,How to handle app crashes in mobile development?,"App crashes are frustrating. What are the best practices for handling errors in mobile development?","mobile development, debugging, crashes, error handling"
30,What are the differences between iOS and Android development?,"Developing for iOS and Android seems different. What are the major differences developers should know?","mobile development, iOS, Android, differences, platforms"
31,How to start developing mobile apps as a beginner?,"I want to create mobile apps but don't know where to start. What are the first steps I should take?","mobile development, beginner, learning resources, getting started"
32,What are the advantages of using Flutter for mobile app development?,"I have heard a lot about Flutter. What makes it a good choice for mobile development?","mobile development, Flutter, cross-platform, advantages"
33,How to optimize mobile app performance for low-end devices?,"My app runs slowly on older devices. What are some strategies to improve its performance?","mobile development, performance optimization, low-end devices, strategies"
34,What are the key differences between native and hybrid apps?,"I am trying to decide between native and hybrid app development. What are the pros and cons of each?","mobile development, native apps, hybrid apps, comparison"
35,How to design a user-friendly mobile app interface?,"I want to create an app with an intuitive design. What are some principles to follow?","mobile development, UI design, user-friendly, best practices"
51,What is the difference between private and public clouds?,"Cloud computing offers various deployment models. Can someone explain the key differences between private and public cloud services?","cloud computing, private cloud, public cloud, deployment"
52,How to optimize cloud storage for better performance?,"Cloud storage is a critical part of infrastructure. How can businesses or individuals optimize it for faster and more reliable performance?","cloud computing, storage optimization, infrastructure, performance"
53,What are the advantages of hybrid cloud infrastructure?,"Hybrid cloud infrastructure is becoming popular. What are its advantages over other models?","cloud computing, hybrid cloud, scalability, infrastructure"
54,How does serverless computing work in the cloud?,"Serverless computing sounds interesting. How does it work and what are its benefits?","cloud computing, serverless computing, benefits, costs"
55,What are the key challenges in cloud security?,"Security in cloud computing is a concern. What are the key challenges and how can they be addressed?","cloud computing, security, challenges, solutions"
56,How to ensure data security in the cloud?,"Data security is a major concern for me. What measures can I take to protect sensitive information in the cloud?","cloud computing, data security, best practices, protection"
57,What is the difference between public private and hybrid clouds?,"I am confused about the types of cloud environments. Can someone explain their differences and when to use each?","cloud computing, public cloud, private cloud, hybrid cloud"
58,How to migrate applications to the cloud?,"I am planning to move my applications to the cloud. What are the steps and best practices for a smooth migration?","cloud computing, migration, applications, best practices"
59,What are the key differences between AWS Azure and Google Cloud?,"I am evaluating cloud platforms. Can someone outline the differences between these major providers?","cloud computing, AWS, Azure, Google Cloud, comparison"
60,What are the cost management strategies in cloud computing?,"Cloud costs are piling up. What strategies can I use to optimize spending?","cloud computing, cost management, optimization, strategies"
76,How can small businesses increase their customer base?,"Many small businesses struggle to attract new customers. What strategies or tools can help increase their visibility and sales?","business, customer acquisition, marketing, tools"
77,What are the key elements of a successful business strategy?,"A solid business strategy is key to success. What are the essential elements that every business plan should include?","business, strategy, planning, goals"
78,How to create an effective marketing plan for startups?,"Startups often need effective marketing plans. What are the best practices for creating one?","business, marketing plan, startups, budgeting"
79,What are the common challenges in scaling a business?,"Scaling a business can be tough. What are the common challenges and how can they be overcome?","business, scaling, growth, funding"
80,How to improve customer retention for small businesses?,"Customer retention is crucial for small businesses. How can it be improved effectively?","business, customer retention, loyalty, CRM"
81,What are the key steps to starting a successful small business?,"I am planning to start a small business. What are the critical steps to ensure its success?","business, small business, entrepreneurship, strategy"
82,How to create an effective business plan?,"I need a solid business plan to secure funding. What should it include, and how do I get started?","business, business plan, funding, planning"
83,What are the latest trends in digital marketing for 2024?,"I want to stay ahead in digital marketing. What are the key trends to focus on this year?","business, digital marketing, trends, 2024"
84,How to manage cash flow effectively in a small business?,"Cash flow issues are a challenge for my business. What strategies can help manage it better?","business, cash flow, management, small business"
85,What are the benefits of adopting sustainable practices in business?,"I want my business to be eco-friendly. How can sustainability improve profitability and reputation?","business, sustainability, profitability, reputation"